title,company,experience,salary,location,description,skills,posted
"Data Steward, Analyst/Associate",Goldman Sachs,0-3 Yrs,,Bengaluru,"SKILLS & EXPERIENCE WE ARE LOOKING FOR Relevant experience in data management, sales re...","Automation, Data management, Wealth management, Analytical, Mutual funds, Reconciliation, Asset management, Macros",3+ weeks ago
Data Analyst,Wonderla Holidays,3-5 Yrs,"50,000-80,000 PA",Bengaluru,Preferred candidate profile,"D2C, Google Data Studio, R, Google Analytics, Power BI, business metrics, Campaign Analytics, Tableau",1 day ago
Looking For immediate joiners - Lab Data Analyst-Python Programming,IQVIA,2-4 Yrs,,Hybrid - Kolkata,"Job Title : Lab Data Analyst-Python ProgrammingSkill : Python programming, data analys...","PYTHON PROGRAMMING, Pyspark, Logical Approach, Python Data Analytics, Python Data, PYTHON SCRIPTING, Numpy, Analytics",5 days ago
Data Analyst - 10th April - Virtual Interview - Pan India,Tata Consultancy Services,7-12 Yrs,,"India, Bengaluru, Mumbai (All Areas)","Hands-on experience with Databricks, Amazon Redshift, and RESTful APIsRequired Technica...","Power BI, Tableau, Data Analytics, Analytics, Bi, Data analysis, Data, Interviewing",3 days ago
"Auth Fraud Supervisor- Data Analyst, UIDAI/Bengaluru",National Institute for Smart Government (NISG),6-10 Yrs,13-23 Lacs PA,Bengaluru,Education Qualification:• B. Tech /MCA /Engineering or• Bachelor's degree in Data Analy...,"Data Analysis, Fraud Management, Python, SQL, Fraud Analytics, R, Identity fraud, Business Analysis",1 week ago
Data Analyst,MNC,0-2 Yrs,2.75-5 Lacs PA,"Pimpri-Chinchwad, Pune",We are looking for a motivated and detail-oriented Data Analyst (Fresher to 2yr) to joi...,"Google Sheets, Power BI, MS Office, Data Analytics, Python, Large Databases, Google Data Studio, data vis",3 days ago
Data Analyst,MNC,0-2 Yrs,2.75-5 Lacs PA,"Pimpri-Chinchwad, Pune",We are looking for a motivated and detail-oriented Data Analyst (Fresher to 2yr) to joi...,"Google Sheets, Power Bi, MS Office, SQL, Data Analytics, Large Databases, Google Data Studio, data vis",4 days ago
Data Analyst (English Required),Peroptyx,0-5 Yrs,,Remote,"For thousands of years, maps have provided humans with the knowledge they need to make ...","Data Analysis, English, Data Analytics, Data Mapping, Analysis, Analytics, Mapping, Data",1 day ago
DATA ANALYST,Godigi Infotech,,Unpaid,Pune,,,Starts in 1-3 months
Data Analyst,Optum,3-5 Yrs,15-20 Lacs PA,Hybrid - Bengaluru,"Description - ExternalOptum is a global organization that delivers care, aided by tech...","Data Analytics, Customer Journey Analytics, Adobe Analytics, Adobe, Data analysis, Analytics, Data",2 days ago
Data Analyst,Jewelex India,1-3 Yrs,3-4 Lacs PA,Mumbai (All Areas),"Required Skills: . Advanced MS Excel (Pivot Tables, VLOOKUP / XLOOKUP, formulas, dashbo...","Data Analytics, Pivot Table, Power BI, VLOOKUP, Advanced Excel, HLOOKUP, SQL, Python",Just now
Data Analyst,CUMI,0-1 Yrs,4-6 Lacs PA,Chennai,"Build our analytical frameworks by predictive forecastingnew tool implementation, new m...","Automation Tools, Prompt Engineering, Ai Strategy, Data Visualization, Data Analytics, Machine Learning, Kpi Dashboards, Data",2 weeks ago
Data Analyst,Alstom,4-9 Yrs,,Bengaluru,"Supporting the lifecycle of analytics and automation solutions, from development to con...","data analyst, storytelling, rpa, data analytics, data analysis, sla, power bi, machine learning",1 week ago
Data Analyst,ti Steps,0-1 Yrs,3.5-6.5 Lacs PA,"Hyderabad, Chennai, Bengaluru",Strong proficiency in Python or R for data analysis and model building. . Hands-on expe...,"Data Analysis, Data Visualization, SQL, Power Bi, Data Cleansing, Tableau, Data Analytics, Analytics",1 week ago
Online Data Analyst Odia (IN),TELUS Digital,0-5 Yrs,,Remote,This freelance opportunity allows you to work at your own pace and from home. . A day i...,"Oriya, oriya speaker, odiya, Language Editing, Power BI, Artificial Intelligence, Content Writing, content",2 days ago
Data Analyst,Forvis Mazars,0-1 Yrs,,Hybrid - Pune(Kharadi),BE / B Tech in IT / ECE/EEE / AI/CSE streams He / she will work alongside a team of ana...,"Data Analytics, BI, Data Analysis, Tableau, SQL, Analysis, Analytics, Data",2 days ago
Data Analyst,eClerx,2-5 Yrs,,Bengaluru,". Bachelors degree in Data Science, Computer Science, Finance, Business Analytics, or a...","Automation, Power BI, Data Analytics, SQL, Python, Data Analysis, Tableau, Analytics",1 day ago
Data Analyst,Krazy Bee Services,2-3 Yrs,,Bengaluru,3 years of analytics experience preferably in fintechs is a plusYour information will o...,"Excel, Python, SQL, Data Analysis, Data Visualization, Data Analytics, Analytics, Analysis",2 days ago
Data Analyst,Kantar,0-4 Yrs,,Hyderabad,"Experience using web services and languages, including AWS, EC2, S3, Redshift, DigitalO...","Sql, Etl Tool, Power Bi, Data Mining, Machine Learning, Data Science, R, S",1 day ago
Data Analyst,Adani Group,2-4 Yrs,,Ahmedabad,Experience with Python programming language for automating tasks or developing custom s...,"Data Analysis, Power BI, KPI, Power Automate, Data Visualization, Advanced Excel, Data Analytics, Reporting",1 day ago
Data Analyst,MNC,0-1 Yrs,2.5-5 Lacs PA,"Pimpri-Chinchwad, Pune",. Freshers with relevant internships / projects can applyRequired Skills: . SQL (mandat...,"Power Bi, MS Office, SQL, Google Suite, Data Analytics, Large Databases, Google Data Studio, Data Management",3 weeks ago
Data Analyst,MNC,0-2 Yrs,2-5 Lacs PA,"Pimpri-Chinchwad, Pune",. Freshers with relevant internships / projects can applyRequired Skills: . SQL (mandat...,"Power Bi, MS Office, SQL, Google Suite, Data Analytics, Large Databases, Google Data Studio, Data Management",3 weeks ago
Data Analyst,Leaf Round,1-2 Yrs,,Bengaluru,"1 to 2 years of experience in Data Analytics, Business Analytics, or a similar roleExpe...","data analyst, pandas, analytics, data analytics, automation, business analytics, google sheets, capital markets",5 days ago
Data Analyst,LiveLike,,Unpaid,Gurugram,,,Starts in 1-3 months
Data Analyst,MNC Group,0-1 Yrs,6-7 Lacs PA,Gurugram,Preferred candidate profile Official communications will only come from @persolkelly.co...,"Artificial Intelligence, Advanced Excel, VBA, Macros, Python, Data analysis, Excel, Data",1 day ago
Data Analyst,Raam4Wheelers LLP,1-4 Yrs,3-3.75 Lacs PA,Hyderabad(Banjara hills +1),Preferred candidate profile . Strong analytical and problem-solving skillsGood attentio...,"Google Sheets, Excel, Google Forms, Data Analysis, Data Analytics, Excel Sheet, Data, Google",1 day ago
Data Analyst,Sunshine Pediatric And Family Clinic Private,1-2 Yrs,2.25-3.5 Lacs PA,Remote,Required Skills. Strong analytical and problem-solving skills. . Advanced Microsoft Exc...,"Data Analytics, Communication Skills, Power BI, Data Analysis, Data Visualization, US Healthcare, Analysis, Analytics",1 day ago
Data Analyst,3i Infotech,2-3 Yrs,4.5-5 Lacs PA,Mumbai(Lower Parel),Responsibilities:Collaborate with cross-functional teams on project deliverablesAnalyze...,"SQL, Query Writing, Data Analysis, Data Visualization, Data Extraction, Data Cleansing, Advance SQL, ETL",2 days ago
Data Analyst,bp,3-6 Yrs,12-15 Lacs PA,Hybrid - Pune,Shift Timings - 12:30 PM 9 PM ISTBachelor s degree or equivalent experience or equivale...,"Power Bi, Data Visualization, Data Analytics, SQL, Python, Sql Joins, Dashboards, Data analysis",1 week ago
"Data Analyst(Alteryx, Tableau Mandatory)",Vipany Management Consulting,2-4 Yrs,9-11 Lacs PA,Hybrid - Hyderabad,". Bachelors Degree or Associate s Degree in Business, Analytics, or a related disciplin...","Alteryx, Tableau, SQL, Data Analysis, Data Visualization, Data Analytics, Data Reporting, Analytics",3 days ago
Data Analyst,ti Steps,0-1 Yrs,3.5-6.5 Lacs PA,"Hyderabad, Chennai, Bengaluru",The ideal candidate should have strong technical expertise across the entire developmen...,"Data Management, Data Analysis, Data Cleansing, Data Reporting, Power Bi, Data Visualization, Tableau, Data Analytics",1 week ago
Data Analyst (Female),Leading Client,0-2 Yrs,,Hazaribagh,Strong analytical and problem-solving skills are required,"Data Analysis, python, business data, business insights, power bi, google sheets, data analyst, sql",2 days ago
AI and Data-Fraud Data Analyst-VG-W6-ES and F0121,EY,5-10 Yrs,,Hyderabad,EWT will also support our internal technology needs by focusing on a better user experi...,"Data Analyst, S3, Matplotlib, Coaching, Architecture, Power Bi, Feature Engineering, Ai",1 week ago
Data Analyst,Cielo Talent,2-4 Yrs,,Hybrid - Bengaluru,2+ years of experience in Retail and Merchandising reporting Experience working with AI...,"Power BI, Data Analysis, Advanced Excel, SQL, Python, Retail Analytics, Tableau, Data Analytics",1 day ago
Data Analyst,Tata Technologies,3-8 Yrs,,Pune,"Minimum Requirements: . Bachelors degree in supply chain management, Data Science, Busi...","data analyst, snowflake, data analysis, power bi, regulatory compliance, sales, marketing, tableau",1 day ago
Data Analyst - CB&P CDO,Barclays,1-8 Yrs,,Pune,". Hands-on experience with SQL, Python, AWS, and data analytics tools for data extracti...","Automation, Data management, Senior Analyst, Analytical, Data quality, Risk management, Continuous improvement, Operations",2 days ago
Data Analyst,Apptad,0-3 Yrs,,"Prayagraj, Varanasi, Ghaziabad, Kanpur, Lucknow, Agra",Required Skills . Strong knowledge of Financial Analysis and MIS Reporting. . Advanced ...,"Tally, ERP, Financial statements, Financial analysis, Financial planning, Business planning, Cash flow, Budgeting",3 days ago
Walk-in || Data Analyst,Everest Fleet,,3-4.5 Lacs PA,,"Bachelors degree in Statistics, Mathematics, Computer Science, Engineering, Economics, ...","Power Bi, Bi, Data Visualization, Data Analytics, SQL, Data Analysis, Bi Tools, Tableau",6 days ago
Data Analyst,Sunbrilo Technology,3-8 Yrs,,"Pune, Bengaluru","Preferred Qualifications: . Bachelors degree in Data Science, Information Systems, Comp...","Data Analysis, data migration, SQL, Python, SaaS environment, ETL, Environment, SAAS",1 day ago
Data Analyst,MAN Truck & Bus,4-6 Yrs,,Pune,. Microsoft Certified: Power BI Data Analyst Associate (PL300) . Experience with enterp...,"microsoft power bi, advanced analytics, python, data analytics, data analysis, sap, performance tuning, software testing",1 week ago
Data Analyst,Chartered Speed,0-1 Yrs,,Ahmedabad(Sanathal),"Job Summary:(Only for Female) We are looking for a Data Analyst to collect, analyze, an...","Power Bi, Bi, Data Analytics, Data, Analytics, Data analysis",2 weeks ago
Data Analyst,Rishabh Gupta Corp,0-4 Yrs,3-5 Lacs PA,"Mumbai (All Areas)(Gamdevi), Hughes Road Gamdevi, Grant Road West","Utilize techniques (coding preferred) to manipulate and analyze data, build data models...","Artificial Intelligence, Statistical Modeling, Data Analytics, Statistics, Python, Data Visualization, SQL, Data",2 weeks ago
Data Analyst,Tradeweb,2-4 Yrs,,Bengaluru,"The ideal candidate will possess strong technical expertise in SQL and Python, along wi...","Snowflake, Cd, Ci Cd Pipeline, Bi, Tools, Ci/Cd, Tableau, Verbal Communication",1 day ago
Sustainability Data Analyst,Thomson Reuters,2-7 Yrs,,Mumbai,"Proven experience in data analysis, preferably 2+ years, with demonstrated ability to w...","Stakeholder Engagement, Data analysis, Analytical, Market intelligence, Labour, Data quality, Data Analyst, data visualization",1 day ago
Data Analyst,Financial Service,5-10 Yrs,,Hybrid - Pune,"Willingness to work flexible shifts, including UK and US time zonesRecommend process en...","O2C, SAP, Order To Cash, Data Analytics, CRM, Genesys, Data quality, siebel",1 week ago
ESG Data Analyst,SunTec India,0-2 Yrs,"50,000-2 Lacs PA",New Delhi(Pitampura),Skills & Qualifications Required: . Educational Background: Graduate in Commerce or Sci...,"Backend Operations, computer operator, Back Office, Back Office Support, Data Entry Operation, researc, Data entry, Backend",Few hours ago
Factory supervision and Data Analyst ( fertilizer industry),Phoenix Plants Lifesaver,2-4 Yrs,3-4.5 Lacs PA,Panipat,"Candidates having experience in manufacturing, fertilizer, or chemical industries with ...","Advanced Excel, Data Analytics, Team Management, Inventory Management, Stock Management, Production Management, Documentation, MIS Reporting",4 days ago
Data Analyst,The Kpi Institute,2-5 Yrs,,Remote,Develop and maintain complex data models and dashboards to support business decision-...,"algorithms, data analysis, data analytics, bi, power bi, data integrity, 8d, dashboards",4 days ago
Data Analyst,Viaprom Technologies,2-5 Yrs,,Bengaluru,Role Overview: We at VIAPROM are seeking a skilled Data Analyst with 2-5 years of exper...,"data analyst, analytics, python, data analytics, data analysis, automation, data validation, data processing",5 days ago
Data Analyst,Statusneo Technology Consulting,5-10 Yrs,14-22.5 Lacs PA,Hybrid - Bengaluru(Whitefield),Work with Python / Django-based Frameworks [DI1] where requiredMake lightweight UI or w...,"Dashboards, Reporting, Analytics, SQL, Python, Data Analytics, Data analysis, Data",3 days ago
Data Analyst,Knowledge Park,2-7 Yrs,,Mumbai,. M Tech (Data Science) / M Sc (Statistics) / MBA (Business Analytics) or equivalent fr...,"Automation, Business analytics, Analytical, Data collection, power bi, Senior Business Analyst, Data Analyst, Data analytics",1 week ago
Data Analyst,Knowledge Park,2-7 Yrs,,Mumbai Suburban,. M Tech (Data Science) / M Sc (Statistics) / MBA (Business Analytics) or equivalent fr...,"Automation, Business analytics, Analytical, Data collection, power bi, Senior Business Analyst, Data Analyst, Data analytics",2 weeks ago
S&C GN - Data&AI - Resources -  Analyst,Accenture,4-8 Yrs,,Bengaluru,About The Role  TBD Qualification TBD,"python, data analysis, machine learning, artificial intelligence, sql, data analytics, natural language processing, data mining",3 days ago
Data Analyst,Data Economy,8-13 Yrs,,Gurugram,"Shift Time - 12 PM to 8:30 PM IST . Role Summary  . CFA designation preferred, or curre...","Analytical, Consulting, Senior Data Analyst, power bi, Data Analyst, Data analytics, Asset management, SQL",1 week ago
Data Analyst,MAN Truck & Bus,3-5 Yrs,,Pune,"Flexibility, initiative, and strong communication skills in English . Proficiency in MS...","python, data analysis, sap, mathematics, sap business warehouse, bi, power bi, sap analytics cloud",1 day ago
Data Analyst,Motivity Labs,5-10 Yrs,,Hyderabad,Requirements: . 25 years of relevant experienceExperience: 5+ Years Hands-on experience...,"BI, Data Visualization, SQL Queries, Data Analytics, SQL, BI Tools, Power BI, Dashboards",1 day ago
Data Analyst (IoT),Log9 Materials,0-6 Yrs,,Bengaluru,Work Type: Full Time . Qualifications . Master s or Bachelors degree in a relevant fiel...,"SAS, big data analytics, Data Analyst, Customer service, Business intelligence, Macros, Analytics, Reporting tools",3+ weeks ago
Data Analyst,Tata Consultancy Services,8-11 Yrs,,Nagpur,Job Description: Data Analyst Experience RequiredData Analyst: 8-10 yearsSenior Data An...,"Shell Scripting, Data Analysis, ETL, Life Insurance, PLSQL, Python, SQL, Analysis",2 days ago
Data Analyst,MAN Truck & Bus,5-8 Yrs,,Pune,"Flexibility, initiative, and strong communication skills in English . Advanced proficie...","bi, vlookup, dashboards, report automation, sql, automation, advanced excel, reporting",1 day ago
Data Analyst,Policybazaar,2-6 Yrs,6-10 Lacs PA,Gurugram,Design and maintain databases using relational databases such as MySQL or PostgreSQL. J...,"SQL, Data Analysis, Data Visualization, Tableau, Data Analytics, Python, Analysis, Analytics",2 days ago
Data Analyst,Siemens,3-8 Yrs,,Bengaluru,"Bachelors degree in Data Science, Statistics, Computer Science, or equivalent 3+ years ...","data analyst, python, project management, data processing, data warehousing, business intelligence, sales, sql",1 week ago
Data Analyst,Bajaj Finance,1-2 Yrs,,Pune,"Graduate or PostGraduate in Computer Science, Information Technology, or Data Science /...","Data Analyst, Azure, Eda, Power Bi, Big Data, Tableau, Elt, Devops",1 week ago
Data Analyst,PwC Service Delivery Center,2-5 Yrs,,Bengaluru,Shift Timing : 3:00 PM - 12:00 AM. Required Knowledge / Skills (BQ): Strong experience ...,"Power Bi, Dax, ETL, Python, SQL, Data Engineering, Data Visualization, Data Extraction",1 week ago
Data Analyst - App Data,Greedygame Media,2-5 Yrs,,Bengaluru,"Requirements . 2 4 years of experience in Product Analytics, Data Analytics, or Growth ...","Product quality, Health insurance, Data analysis, Publishing, power bi, Data analytics, data visualization, Analytics",2 weeks ago
Data Analyst,Salespoint,0-3 Yrs,,Remote,Requires Bachelor s in Technology Engineering + 6 months experienceProficiency in SQL a...,"Media marketing, Analytical, Machine learning, Cloud, Manager Technology, Market assessment, E-commerce, Data Analyst",2 days ago
DATA ANALYST L3,Wipro,3-5 Yrs,,Pune,Experience: 3-5 Years . . .,"Data Analyst, Data Validation, Automation, C, Business Analytics, Digital Transformation, Emr, Reporting Tools",1 week ago
Data Analyst,Cargill,4-7 Yrs,10-16 Lacs PA,Hybrid - Bengaluru,"Bachelors degree in Data Science, Statistics, Computer Science, Business Analytics, or ...","Power Bi, Data Science, AL/ML, Snowflake, AWS, Predictive Modeling, Big Data, Power Platform",4 days ago
Data Analyst Proficient,Softtek,3-5 Yrs,,Bengaluru,Data Analyst Proficient . Role Description . Data Quality with experience in Analytics ...,"Data validation, Analytical, Agile, data governance, Data Analyst, Data quality, Business intelligence, Stakeholder management",1 day ago
Data Analyst,Financial Service,5-10 Yrs,,Hybrid - Bengaluru,"Willingness to work flexible shifts, including UK and US time zonesRecommend process en...","O2C, SAP, Order To Cash, Data Analytics, CRM, Genesys, Data quality, siebel",1 week ago
Data Analyst,Prospect Info Solution,1-5 Yrs,,Noida,"Analyze complex data sets to identify trends and patterns, providing insights to stake...","database maintenance, python, macros, data analysis, data analytics, data mining, predictive analytics, power bi",1 week ago
Data Analyst,Embarkgcc Services,2-6 Yrs,,Bengaluru,"Role & responsibilities Data Analyst (SQL & Python)Location: Embassy TechVillage, Benga...","Data Analytics, Python, SQL, Pyspark, Data analysis, Analytics, Data",1 week ago
Data Analyst,ADA Global,3-4 Yrs,,Bengaluru,"Key Responsibilities: . Design, build, and maintain end-to-end Tableau dashboards and r...","server, python, oracle, data analysis, data warehousing, microsoft azure, transformation, sql server",1 day ago
Data Analyst,Aon,2-5 Yrs,,Bengaluru,"Position type- Full Time. Work Location- Bangalore, Whitefield. Required years of exper...","data science, Agile scrum, Project management, Analytical, power bi, Data Analyst, Stakeholder management, Data warehousing",2 days ago
Data Analyst,Doorstep,2-5 Yrs,,Noida,We are looking for a highly skilled Data Analyst with 2 to 5 years of experience to joi...,"python, macros, data analysis, data analytics, predictive analytics, problem solving, data integrity, machine learning",1 week ago
Data Analyst,Innova Solutions,7-12 Yrs,15-30 Lacs PA,"Hybrid - Noida, Hyderabad, Chennai",Shift : 2pm to 11pm. Work Location : Hyderabad / Noida/Bang / ChennaiSpecialization: Mu...,"Data Analysis, Data Visualization, Data Analytics, DA, Analytics, DAS, Analysis, Data",3 days ago
Data Analyst,Aster DM Healthcare,3-5 Yrs,,Bengaluru,"Bachelors degree in Data Analytics, Statistics, Computer Science, Information Systems, ...","Healthcare Analytics, Data Analytics, Matplotlib, Power Bi, Data Modeling, Statistical Data Analysis, Numpy, Python",1 week ago
ISC Data Analyst,Rockwell Automation,3-8 Yrs,,Bengaluru,Job Description    Summary:  We are excited to invite you to join our dynamic ISC Anal...,"Supply chain, Automation, SAP, Agile, Data structures, microsoft, Analytics, SQL",1 week ago
Data Analyst,Capco,7-15 Yrs,15-30 Lacs PA,"Pune, Bengaluru",Provide regular reporting on key performance indicators (KPIs) to stakeholders. Job Req...,"Pyspark, Python, Banking, Data Analyst, SQL, Data Analytics, Data, Analytics",2 weeks ago
Data Analyst,Virtusa,6-10 Yrs,,"Hyderabad, Chennai, Bengaluru",Overall 8+ years of experience with 5-6 years experience mining data as a data analystM...,"Pyspark, Healthcare, Data Analyst, Python, SQL, Data analysis, Data",2 days ago
Data Analyst,EY,4-8 Yrs,,"Hyderabad, Gurugram, Bengaluru",". Resourcing requirements . Resources to be assigned on T&M basis, fungible to work acr...","SAS, Credit Risk, SQL, Altair, GCP, Requirement Gathering, Data Analysis, Requirements",2 days ago
Data Analyst,Incanus Technologies,1-6 Yrs,5-15 Lacs PA,"Hybrid - Pune, Bengaluru, Delhi / NCR","Graduates from any discipline, unleash your potential!Note: We will be reaching out to ...","Python, SQL, Excel, Data analysis, Data",1 week ago
Data Analyst,Codinglimits Nellore,0-1 Yrs,,"Hyderabad, Chennai, Bengaluru",Data Analyst Fresher Location: Bengaluru | Chennai | Hyderabad Employment Type: Full-T...,"Power Bi, SQL, Python, Data Visualization, Tableau, Data Analytics, Data analysis, Analytics",2 weeks ago
Hiring For Data Analyst (Tableau),Lumina Datamatics,2-5 Yrs,5-9 Lacs PA,"Mumbai, Pune, Mumbai (All Areas)",Utilize SQL skills to extract data from various sources for analysis purposes. . Troubl...,"Tableau, Advance Sql, data analyst, Tableau Reporting, Data Visualization, Tableau Prep, tableau developer, SQL",1 week ago
Data Analyst,ti Steps,0-3 Yrs,3-5 Lacs PA,"Hyderabad, Chennai, Bengaluru","Experience working in Agile / Scrum environments. Experience with cloud platforms (AWS,...","Data Management, Data Visualization, Tableau, Data Analytics, Data Reporting, Power Bi, Data Analysis, Data Cleansing",2 weeks ago
Data Analyst,Clustor Computing,0-2 Yrs,,Nagpur,"Bachelor s / Master s degree in Data Science, Statistics, CS, or related fieldRequired ...","Analytical skills, Data analysis, Manager Quality Assurance, data science, power bi, Data analytics, data visualization, digital transformation",3+ weeks ago
Data Analyst,Anarock Property Consultants,2-3 Yrs,10-14 Lacs PA,Mumbai(Bandra Kurla Complex),"To do well in this role you need a very fine eye for detail, experience as a data analy...","Data Analytics, ETL, Power Bi, Data Analysis, Statistical Modeling, Machine Learning, Python, SQL",1 week ago
Data Analyst,Financial Service,5-10 Yrs,,Hybrid - Hyderabad,"Willingness to work flexible shifts, including UK and US time zonesRecommend process en...","O2C, SAP, Order To Cash, Data Analytics, CRM, Genesys, Data quality, siebel",1 week ago
Data Analyst,Financial Service,5-10 Yrs,,Hybrid - Ahmedabad,"Willingness to work flexible shifts, including UK and US time zonesRecommend process en...","O2C, SAP, Order To Cash, Data Analytics, CRM, Genesys, Data quality, siebel",1 week ago
Data Analyst,Financial Service,5-10 Yrs,,Hybrid - Chennai,"Willingness to work flexible shifts, including UK and US time zonesRecommend process en...","O2C, SAP, Order To Cash, Data Analytics, CRM, Genesys, Data quality, siebel",1 week ago
Data Analyst,TP,3-8 Yrs,,Gurugram,Specialized schooling or previous practical experience likely to be required.,"customer service, customer experience management, issue resolution, product specification, hrsd, software installation, specifications, job description",2 days ago
Data Analyst,Financial Service,5-10 Yrs,,Hybrid - Mumbai,"Willingness to work flexible shifts, including UK and US time zonesRecommend process en...","O2C, SAP, Order To Cash, Data Analytics, CRM, Genesys, Data quality, siebel",1 week ago
Data Analyst,Financial Service,5-10 Yrs,,Hybrid - Delhi / NCR,"Willingness to work flexible shifts, including UK and US time zonesRecommend process en...","O2C, SAP, Order To Cash, Data Analytics, CRM, Genesys, Data quality, siebel",1 week ago
Data Analyst 3,Zynga,5-10 Yrs,,Bengaluru,"Masters, MBA or PhD preferred. 5+ years of work experience in data science or analytics...","Computer science, data science, Diversity and Inclusion, Machine learning, QlikView, Gaming, Analytics, SQL",1 day ago
Data Analyst,Financial Service,5-10 Yrs,,Hybrid - Kolkata,"Willingness to work flexible shifts, including UK and US time zonesRecommend process en...","O2C, SAP, Order To Cash, Data Analytics, CRM, Genesys, Data quality, siebel",1 week ago
Data Analyst,iit Academy,3-5 Yrs,,Samastipur,Position: Manager. brief: IIT Academy is looking for experienced and energetic candidat...,"Analytical skills, Automation, Data analysis, Data validation, Technical writing, Data Analyst, Business process management, data visualization",1 week ago
ESG Data Analyst (off-Roll),Crisil Analytices,5-10 Yrs,,Pune,Role       : ESG Data Analyst              Position type:      Offroll (QuessCorp...,"NISM, Payroll, Usage, Excel, Finance, Corporate, Data Analyst, Advanced Excel",1 week ago
Data Scientist / Data Analyst,Mount Talent Consulting,3-20 Yrs,,Bengaluru,"Requirements: minimum 3 years of relevant experience, strong domain expertise and excel...","Python, R, Statistics, Machine Learning, SQL, Data analysis, Machine, Data",1 week ago
Data Analyst,Ecolab Global Services,6-8 Yrs,,Pune,The employee should demonstrate mastering of skills in at least two of the following da...,"Data Analyst, Data Systems, Data Analysis, Research, Etl, Elt, Data Governance, Sql",1 week ago
Data Analyst,Innova Solutions,7-12 Yrs,,"Hybrid - Hyderabad, Bengaluru, Greater Noida",Shift & Mode : 2pm to 11pm -(3 Days WFO). .,"Banking Analytics, Data Analytics, Python, SQL, Segmentation, Data Analysis, Analytics, Analysis",1 week ago
