title,company,experience,salary,location,description,skills,posted
Excellent Job Opening  _ Data Analyst _ Chennai,Clover Infotech,7-12 Yrs,,Chennai,Requirement : Data Analyst / Team Lead. Total Experience: 7+ years. Strong experience i...,"Data Warehousing, Financial Sector, Data analyst, Banking Sector, Data Modeling, ETL, SQL, Modeling",3+ weeks ago
Knowledge Analyst Data Curation & Classification,Sia Partners,2-7 Yrs,,Mumbai,"Bachelor s degree in Business, Information Management, or a related field. 2+ years of ...","Content management, Automation, operational support, Analytical, Consulting, Data processing, Data quality, Information management",2 weeks ago
Specialist- Data & Planning Analyst,Nordex Engineering And Technology,6-8 Yrs,,Chennai,"Maintain and update master data in SAP . HANA and Osapiens for defective parts, repaira...","Supply chain, Material management, Data validation, operational support, Claims, Analytical, Maintenance Manager, Forecasting",3 weeks ago
Data Analysts,Patio Digital,3-6 Yrs,,Faridabad,"Desirable candidates must be proficient in data entry, MS excel and must be detail orie...","Excel, Data entry, Data analysis, Analysts, Data",3+ weeks ago
Specialist- Data & Planning Analyst,Nordex Group,2-5 Yrs,,Chennai,"Maintain and update master data in SAP . HANA and Osapiens for defective parts, repaira...","operational support, data analysis, software testing, data validation, supply chain, data manipulation, kpi, forecasting",3+ weeks ago
Data Governance Analyst,Msbc Group,2-7 Yrs,,Remote,Data Governance Analyst         Job Category:    Data Governance Analyst      Job Type:...,"Automation, Data management, Coding, Fixed income, Analytical, Data quality, Analytics, Financial services",3+ weeks ago
Analyst - Data Integration,Ansell,7-10 Yrs,,Mumbai,Ensure data quality and integrity by implementing data validation and testing procedure...,"data, integration, analyst, professional skills, Data analysis, Analysis, Data integration",3+ weeks ago
Data Governance Analyst,Data Economy,3-8 Yrs,,Hyderabad,"Requirements . Education: . Bachelor\degree\ in Computer Science, Information Systems, ...","Computer science, Health insurance, Data management, Analytical, data governance, Issue resolution, Informatica, Operations",3+ weeks ago
Data informatics Analyst,Ivtree It Solutions,4-7 Yrs,,Hyderabad,Disclaimer: This job description has been sourced from a public domain and may have bee...,"database maintenance, data analysis, oracle, data management, data validation, problem solving, informatics, sql",3+ weeks ago
Analyst - Data Integration,Ansell,7-10 Yrs,,Navi Mumbai,Ensure data quality and integrity by implementing data validation and testing procedure...,"data, integration, analyst, professional skills, Data integration, Analysis, Data analysis",3+ weeks ago
Knowledge Analyst Data Curation & Classification,Sia Partners,2-5 Yrs,,Mumbai,"Bachelor s degree in Business, Information Management, or a related field 2+ years of e...","Compliance, Knowledge Analyst, Analytical, Consulting, Data processing, Data quality, Information management, Management",3+ weeks ago
Data Analyst/Engineer,BMW Techworks India,2-5 Yrs,,Bengaluru,"Analyze complex data sets to identify trends and patterns, providing insights to stake...","hive, python, data analysis, data analytics, data warehousing, power bi, machine learning, data engineering",3+ weeks ago
Senior Executive - Data Analyst,Startek,0-3 Yrs,,Hosur,Develop and maintain complex data models and databases to support business intelligenc...,"python, project management, data analysis, data analytics, data management, mis reporting, pivot table, business analysis",3+ weeks ago
Data Analysts (Senior/Analyst/Associate),FedEx,0-3 Yrs,,Mumbai,"Ensure data accuracy, completeness, and integrity through quality assurance processes. ...","Computer science, Analytical skills, Data analysis, Manager Quality Assurance, fedex, Data modeling, MIS, Genetics",3+ weeks ago
"Analyst, LLMO",Dentsu Webchutney,0-5 Yrs,,Pune,Time Type: Full timeReporting Tools: Skills to use Looker Studio or Tableau to visualiz...,"Industry research, Data analysis, Web analytics, Senior Analyst, VLOOKUP, Analytical, SEO, SQL",3+ weeks ago
Data Analyst,Banking,4-9 Yrs,8-17 Lacs PA,India,Power Bi+SQL+ETL,"Power Bi, ETL, SQL, Data analysis, Bi, Data",3+ weeks ago
Data Analyst,RIGHT STEP CONSULTING PRIVATE LIMITED,2-6 Yrs,,New Delhi,Experience in preparation of regulatory reports shall be an added advantage. Ability to...,"Excel, Strong analytical skills, Technical, Database, Technical Lead, Commerce, Software, Data Analyst",3+ weeks ago
Data Analyst,Nath Outsourcing Solutions,1-3 Yrs,,Mohali,Work Experience  Candidate with 1 - 3 Years of work experience of Charges Payment Post...,"Payment posting, Data Analyst, US healthcare, Data analysis, Healthcare, Post, Data, Payments",3+ weeks ago
Data Anonymization Analyst,Innova Solutions,4-9 Yrs,,Hybrid - Bengaluru,Own assigned projects or project tasks and deliver such on time and with the required q...,"python, SAS, Clinical Data, sql, Adam, Cdisc, SAS Programming, sdtm",3 weeks ago
Data Analyst with Low Code,Overture Rede,1-3 Yrs,,Ahmedabad,o Provide leadership to the Development team and assist the leadership to deliver resul...,"Front end, MySQL, Debugging, Machine learning, Data structures, HTML, SDLC, Analytics",3+ weeks ago
Data-Analyst,Venus Jewel,2-3 Yrs,,Mumbai,- An educational background must be of computer science or IT 2 to 3 years related expe...,"Computer science, Administration management, deep learning, Excel, Manager Quality Assurance, Management systems, Machine learning, Operations",3+ weeks ago
Data Engineer,Infosys,5-10 Yrs,,Pune,"Bachelor of Engineering, Bachelor Of Technology, Master Of Technology, Master Of Engine...","Data Engineering, Pyspark, Business Intelligence, Scala, Hadoop, Sql Server, Big Data, Tableau",1 day ago
Data Analyst - TRAINEE ENG,Interface Infosys,0-1 Yrs,,"Chennai, Bengaluru","Interpret data, analyze results using statistical techniques and provide ongoing repo...","Data Analyst, Data Systems, Process Improvement, Collection, Data Collection, Data Analytics, Analytics, Statistical Techniques",1 week ago
Hiring Clinical Data Analyst - M.Pharmacy - Freshers,Clininfotech,0-2 Yrs,2.25-3.25 Lacs PA,"Hyderabad(Ameerpet), Pune(Bhavaninagar), Bengaluru(Vijay Nagar)",Urgent Hiring M. Pharmacy fresher Completed Clinical Data Management Training only Elig...,"Mpharm, Quality Assurance, Pharmaceutics, Clinical Research, Pharmacy, pharmacist, Pharmacology, Biochemistry",2 weeks ago
Analyst,Tresvista Financial Services,0-1 Yrs,,Pune,Education . Graduate / MBA. Prior team management experience preferred Required Skills ...,"Team Management, Time Management, Compliance, Accounting, Valuation, Industry Research, Research, Vendor",1 day ago
Analyst Data Privacy,GIG Consultants,1-6 Yrs,,Bengaluru,Shift : 12:00- 9:30pmExperience Required. Budget,"certified information privacy manager, data privacy, certified information privacy professional, gdpr, Data, Management, Data analysis, Certified",3+ weeks ago
Data Engineer/ Analyst,Arna Softech,4-6 Yrs,,Indore,Experience with database design and development. . Proficiency in programming languages...,"hive, algorithms, database maintenance, python, data analysis, data validation, data warehousing, problem solving",2 weeks ago
Data Scientist_Senior Analyst,Globant,4-7 Yrs,,Pune,Stay up-to-date with industry trends and emerging technologies in AI and machine learni...,"rest, python, oracle, vertex, maven, sql coding, sql tuning, machine learning",3+ weeks ago
Data Engineer,Accenture,2-4 Yrs,,Pune,Minimum . 5 year(s) of experience is required. Educational Qualification : 15 years ful...,"data analytics, data engineering, etl, data integration, etl process, hive, python, data analysis",3 days ago
Data Scientist,Infosys,10-14 Yrs,,Bengaluru,Educational RequirementsBachelor of EngineeringService LineData Analytics UnitResponsib...,"data, Predictive Modeling, Artificial Intelligence, Natural Language Processing, Data Mining, Tableau, Machine Learning, Statistics",3 days ago
Data Scientist,Infosys,5-8 Yrs,,Pune,"Educational Requirements Bachelor of Engineering, BCA, BSc. Service Line Topaz COE unit...","Data, Predictive Modeling, Artificial Intelligence, Natural Language Processing, Data Mining, Tableau, Machine Learning, Statistics",1 week ago
Data Analyst / Data Engineer (Internship),Dream It,0-1 Yrs,,Gurugram,"Experience with data analysis tools such as SQL, Excel, or statistical software.","hive, algorithms, python, c++, data analysis, dbms, problem solving, data pipeline",5 days ago
Analyst,eClerx,0-2 Yrs,,Navi Mumbai,"Experience in Data Analytics & Seismic Tool ( Configuration, create layers). Good to ha...","python, data analytics, data validation, bi, seismic, power bi, business analytics, monitoring",1 week ago
Analyst,Tresvista Financial Services,0-2 Yrs,,Pune,Required Skills Experience,"data analytics, analytical, team management, workflow, management skills, industry research, investment, market research",3+ weeks ago
GCP Data Scientist_Senior Analyst,Globant,4-8 Yrs,,Aurangabad,Ability to work in a fast-paced environment and adapt to changing priorities. Disclaime...,"c#, python, project management, c++, css, software development, c, oracle",3+ weeks ago
GCP Data Scientist_Senior Analyst,Globant,4-8 Yrs,,Nashik,Ability to work in a fast-paced environment and adapt to changing priorities. Disclaime...,"c#, python, project management, c++, css, software development, c, oracle",3+ weeks ago
GCP Data Scientist_Senior Analyst,Globant,4-8 Yrs,,Thane,Ability to work in a fast-paced environment and adapt to changing priorities. Disclaime...,"c#, python, project management, c++, css, software development, c, oracle",3+ weeks ago
GCP Data Scientist_Senior Analyst,Globant,4-8 Yrs,,Nagpur,Ability to work in a fast-paced environment and adapt to changing priorities. Disclaime...,"c#, python, project management, c++, css, software development, c, oracle",3+ weeks ago
GCP Data Scientist_Senior Analyst,Globant,4-8 Yrs,,Mumbai,Ability to work in a fast-paced environment and adapt to changing priorities. Disclaime...,"c#, python, project management, c++, css, software development, c, oracle",3+ weeks ago
Data Privacy Analyst,Indusind Bank,7-10 Yrs,20-25 Lacs PA,Hybrid - Mumbai (All Areas),Role & responsibilities  - Develop and maintain the enterprise privacy governance frame...,"data protection, privacy compliance, Data Privacy, HP data protector, Data, Compliance",3+ weeks ago
Analyst Data Integration,Ansell,2-7 Yrs,,Mumbai,"Conduct root-cause analysis for PLAN Comind tickets related to IT BI, Data Lake, Interf...","python, data management, supply chain, ai, databricks, machine learning, master data management, data engineering",3+ weeks ago
Data Analyst (Marathi Speaker - India),Peroptyx,0-5 Yrs,,Remote,"The flexibility of our roles minimizes the impact on your daily routine.So, whether you...","English, Marathi, Data Analysis, Attention To Detail, Mapping, Research, Interpretation, Analysis",1 week ago
Analyst,eClerx,0-4 Yrs,,Mumbai,Conduct thorough analysis of complex data sets to identify trends and patterns. Develo...,"microsoft office applications, database maintenance, data analysis, windows xp, operating systems, problem solving, analysis, autocad",1 week ago
Economic Analyst,Crisil,0-8 Yrs,,Pune,Functional Responsibility / Domain Related              Assist S&P Economists wi...,"Data analysis, Quantitative research, Analytical, Information security, Machine learning, Predictive modeling, Research, Stakeholder management",3+ weeks ago
Chartered Accountant,Bajaj Finserv Health,0-1 Yrs,,"Pune, Bengaluru",Eligible - Only Qualified CA Fresher 2026 Jan Exam & CA fresher 2025 Sept Exam,"Finance Control, ORM, Budgeting, Finance, Accounting, Control",3 weeks ago
Data Intelligence Analyst,Flexm,3-6 Yrs,,Remote,Required Skills Qualifications Databases (SQL preferred). Entity matching. Good to Have...,"Backend, Data analysis, Automation, Data validation, Schema, Data collection, HTML, Manager Quality Control",3+ weeks ago
Data Acquisition Analyst,Amgen Inc,1-3 Yrs,,Hyderabad,"Basic Qualifications and Experience: . Bachelors degree in life sciences, computer scie...","Data Acquisition, Biotechnology, Compliance, Clinical Operations, Data Management, Database Design, Vendor Management, Research",3 weeks ago
Data Engineer / Analyst,Naghavi Fintech,2-5 Yrs,,Bengaluru,Naghavi fintech is looking for Data Engineer / Analyst to join our dynamic team and emb...,"data quality, data analysis, data pipeline, data visualization, etl, data engineering, fintech, Engineering",3+ weeks ago
Analyst (LCMS Data Interpretation),TUV SUD South Asia,2-6 Yrs,,Kolkata,Employment Type: Full time / regularBS / BA in Chemistry or a related field with 5+ yea...,"python, data interpretation, data analysis, data management, natural language processing, data validation, data mining, documentation",3+ weeks ago
Analyst (GC-MS Data Intrepretation),TUV SUD South Asia,3-7 Yrs,,Kolkata,Employment Type: Full time / regularBS / B. Sc in Chemistry or a related field with 5+ ...,"capa, python, data analysis, data management, data validation, quality control, documentation, data integrity",3+ weeks ago
P2B - Data Analyst Principal,Cummins,10-15 Yrs,,Pune,"Bachelors degree in Computer Science, Information Technology, Engineering, Data Science...","Computer science, Automation, Data migration, SAP, Data management, Agile, Data structures, Business intelligence",1 day ago
Data Engineer,Accenture,2-4 Yrs,,Pune,Minimum . 5 year(s) of experience is required. Educational Qualification : 15 years ful...,"data analytics, data engineering, etl, data integration, etl process, hive, python, data analysis",2 weeks ago
Data Analyst & MIS Administrator,Bharati Vidyapeeth University,3-5 Yrs,,Pune(Bharati Vidyapeeth),Preferred candidate profile Power Query / Power Pivot (preferred) Macros / VBA (good to...,"Data Analysis, Marketing Analytics, Marketing Research, Data, Administration, Analytics, MIS, Research",1 week ago
Data Analyst,Renaissance Academy Of Wisdom,0-3 Yrs,3.25-6 Lacs PA,Remote,"Bachelors degree in Data Science, Statistics, Mathematics, Computer Science, Economics,...","Data Analytics, Power Bi, Data Analysis, Data Visualization, Machine Learning, SQL, Python, Machine",2 weeks ago
"Data Analyst Fresher , Data Analytics",Apex Engineering Solutions,0-1 Yrs,5.5-8 Lacs PA,"Kolkata, Pune, Chennai","Job descriptionWe are looking for Data Analyst Freshers , Data Analytics fresher to joi...","Data Analytics, Business Intelligence, Power BI, Data Extraction, Data Cleansing, Advanced Excel, Tableau, Data Entry",1 day ago
Data Analysis Traineeship ly Professional,Gigafactor Solutions,,Unpaid,Pune,,,Starts in 1-3 months
Data Analyst / Web Researcher,Myvirtualdesks,0-3 Yrs,,Pune,Collecting and analyzing large data sets using statistical and data visualization too...,"Data analysis, Web technologies, Data Analyst, Data analytics, data visualization, Management, Forecasting, Testing",3+ weeks ago
Data Analyst Associate,Mhtechin,,Unpaid,Pune,,,Starts in 1-3 months
Analyst,eClerx,0-2 Yrs,,Navi Mumbai,Analyst – Inbound Chat – Customer Operations Pune | Full-time (FT) | Customer Operation...,"advanced analytics, chat process, data analytics, inbound, customer service, financial services, sales, customer support",1 week ago
Analyst,eClerx,0-2 Yrs,,Chandigarh,Job Description: Outbound Voice – Analyst We are seeking motivated individuals to join ...,"voice, data analytics, customer service, verbal communication, policies, crm software, call center technology, financial services",2 weeks ago
Data Engineer - Python,Busigence Technologies,0-3 Yrs,,Remote,Relevant Exp: 0-3 Years   Requirements   This is an immediate requirement. We shall ...,"deep learning, Data analysis, data science, Machine learning, HTTP, Natural language processing, Data analytics, Business intelligence",3+ weeks ago
Senior Officer - CAT Axis,Axis Max Life Insurance,0-5 Yrs,,"Mumbai, Nagpur, Thane, Nashik, Pune, Aurangabad","Manage the zone for all allocated channels, ensuring high performance and positive wor...","Customer acquisition, Business administration, Data analysis, Excel, Project management, Analytical, data visualization, Retention strategies",3+ weeks ago
Data Scientist,Biocube,0-3 Yrs,,Noida,Collaborate with engineering and product development teams . Disclaimer: This job descr...,"algorithms, python, modeling, data analysis, data analytics, natural language processing, predictive, machine learning",3+ weeks ago
Senior Analyst,eClerx,0-3 Yrs,,Pune,Experience working with large datasets and complex data systems. Disclaimer: This job d...,"emerging technologies, data systems, business growth, communication and interpersonal skills, communication skills, Interpersonal, Analysis, Interpersonal skills",3+ weeks ago
Functional Analyst - Data,Kyndryl,5-9 Yrs,,Chennai,The Role    We are looking for a Senior Functional Analyst with strong experience in ...,"Automation, Managed services, Bfsi, Underwriting, Stakeholder management, User acceptance testing, Financial services, Analytics",3+ weeks ago
Senior Data Analyst,Crisil Analytices,4-8 Yrs,,Pune,Manage and maintain Security Master data for private credit / loan instrumentsHands-on ...,"Loans, remediation, Data analysis, Fund accounting, Data validation, Data management, Reconciliation, Data quality",1 week ago
Orchestration Analyst,Ecolab Global Services,2-5 Yrs,,Pune,"Bachelors degree in Computer Science, Statistics, Mathematics, Finance, or a related fi...","Data Analysis, Business Intelligence, Automation, Power Bi, Alteryx, Data Management, Bi, Tools",1 day ago
Analyst,Iqvia Biotech,0-3 Yrs,,"Gurugram, Bengaluru",Qualification Relevant Educational Certification / Degree in related field Supported by...,"Data analysis, Analytical, Consulting, Healthcare, Clinical research, Life sciences, MS Office, Forecasting",2 weeks ago
Senior -Finance Data Analyst- FDI- Commercial,EY,3-6 Yrs,,Pune,"Senior FDI EY GDS Consulting Finance As part of our EY Finance Consulting Team, you wil...","Assurance, SAP, Fixed assets, Project management, Reconciliation, Consulting, Corporate finance, Budgeting",1 day ago
Senior Data Analyst,Crisil,4-8 Yrs,,Pune,Manage and maintain Security Master data for private credit / loan instruments Hands-on...,"Loans, remediation, Fund accounting, Data validation, Reconciliation, Senior Data Analyst, data governance, Data quality",3+ weeks ago
Data Analyst Intern (PST- Shift),Skypoint Cloud,,Unpaid,Bengaluru,,,Starts in 1-3 months
Data Analyst || Fresher Can Also Apply,iTorq Innovations,0-5 Yrs,5-15 Lacs PA,Remote,Preferred candidate profile High-level experience in methodologies and processes for ma...,"Data Research, Data Management, Data Analysis, Data Analytics, Data Sourcing, Data Transformation, Data Interpretation, BI",1 day ago
Business Analyst,Barclays,0-5 Yrs,,Pune,". Good understanding of Agile frameworks, including Scrum and KanbanFormal training in ...","Change management, Senior Analyst, Business analysis, Workflow, MS Office, Risk management, Continuous improvement, Macros",4 days ago
Executive - MIS,Securens Systems,0-4 Yrs,,Chennai,Develop and maintain technical documentation of MIS systems and processes. Disclaimer: ...,"hlookup, macros, data analysis, data management, data analytics, mis reporting, data validation, documentation",3+ weeks ago
Data Analyst,BJS Distribution Storage And Couriers,5-8 Yrs,,Mohali,"Data Analyst to collect, process, and interpret data to support business operations and...","Power Bi, Data Visualization, SQL, Data Analysis, Data Extraction, Data Cleansing, MIS Reporting, Data Reporting",2 weeks ago
Sr Associate - Data Analyst Performance System,Acuity Knowledge Partners,5-8 Yrs,,Pune,"Handson experience building and maintaining dashboards, metadata, and governance artifa...","metadata, alternative investments, data analysis, data analytics, private equity, problem solving, root cause analysis, dashboards",2 weeks ago
Intern - Data Analyst,Visit Health,0-1 Yrs,,Gurugram,". Visit Health Empowering workplaces with accessible, affordable, and impactful healthc...","Data analysis, Intern, Nutrition, Analytical, Healthcare, Data Analyst, Analytics, SQL",3+ weeks ago
Junior Data Analyst,Neev Advisory Research & Consultancy Services,0-2 Yrs,,Gurugram,Knowledge about Indian political system and election is preferred . Proficient with Adv...,"Excel, STATA, Packaging, M&A, Data Analyst, MS Word, SPSS, Research",3+ weeks ago
Data Analyst - Intern,Claight Corporation Expert Market Research,0-1 Yrs,,Noida,LOOKING FOR SOMEONE WITH Educational Background: . Enrolled in or recently graduated fr...,"Data analysis, Intern, Data Analyst, Analytics, Analysis, Data",3+ weeks ago
Senior Officer - CAT Axis,Axis Max Life Insurance,0-2 Yrs,,"Mumbai, Nagpur, Thane, Nashik, Pune, Aurangabad",Manage and analyze large datasets to identify trends and patterns. Develop and impleme...,"rest, data analysis, web services, mathematics, jsp, maven, gmat, jdbc",3 days ago
Senior Data Analyst,BMC Software,4-6 Yrs,,Pune,"Bachelors degree in Statistics, Mathematics, Computer Science, Information Technology, ...","data analysis, business intelligence, sql, tableau, stakeholder management, python, dashboard development, bi",1 week ago
Senior Data Analyst,Honeybee Tech Solutions,4-6 Yrs,"50,000-4.5 Lacs PA",Pune,Provide expert-level support for MIS (Management Information System) projects. Job Requ...,"DATA ANALYST, Power BI, MIS, Data Analysis, Advanced Excel, Tableau, Analysis, Bi",1 day ago
Data Analyst / MIS Executive,RUDRA ANLYTICS,3-8 Yrs,,Pune,Role Overview:  We are looking for a Data Analyst who can convert data into meaning...,"Data analysis, Automation, Data modeling, Analytical, Data collection, data governance, Data quality, Data Analyst",3+ weeks ago
Power BI Data Analyst,Crisil Analytices,3-8 Yrs,,Pune,Perform ad hoc analyses as requested to help management make informed decisions regardi...,"Financial reporting, Coding, Analytical, Financial operations, power bi, Data Analyst, Management, microsoft",1 week ago
Executive Assistant,Randstad,8-13 Yrs,6-10 Lacs PA,Pune(Shivajinagar),Job Title: Executive Assistant to Managing Director & Leadership TeamLocation: PuneJob ...,"Visa Processing, EA, Travel Management, MOM, Calendar Management, Travel, Process, Assistance",2 weeks ago
"Analyst-Data Analytics (SQL, Python, GenAI)",AMERICAN EXPRESS,0-2 Yrs,,Manesar,"B Tech BSc / MSc Statistics, Bachelors / master s in economics. Minimum Qualifications:...","Data analysis, Marketing analytics, Project management, Analytical, Hypothesis Testing, data integrity, Business strategy, Data mining",1 week ago
Analyst-Data Science,AMERICAN EXPRESS,0-2 Yrs,,Manesar,"This role will elevate model excellence, strengthen long term shareholder value, and ad...","Text mining, SAS, data science, Coding, Analytical, Artificial Intelligence, Machine learning, Risk management",1 week ago
Data Analyst (Associate),Aumni Techworks,0-3 Yrs,,Pune,"The ideal candidate should have a strong foundation in scripting, solid Python & SQL sk...","python, data analysis, data manipulation, stakeholder management, power bi, sql, communication skills, Data",3+ weeks ago
Analyst,eClerx,0-4 Yrs,,Chandigarh,Conduct thorough analysis of complex data sets to identify trends and patterns. Develo...,"financial analysis, database maintenance, data analysis, performance tuning, database migration, database mirroring, sql server dba, analysis",1 week ago
"Analyst, LLMO",Dentsu Webchutney,0-5 Yrs,,Bengaluru,Time Type: Full timeReporting Tools: Skills to use Looker Studio or Tableau to visualiz...,"Industry research, Data analysis, Web analytics, Senior Analyst, VLOOKUP, Analytical, SEO, SQL",3+ weeks ago
"Analyst, LLMO",Dentsu Webchutney,0-5 Yrs,,Mumbai,Time Type: Full timeReporting Tools: Skills to use Looker Studio or Tableau to visualiz...,"Industry research, Data analysis, Web analytics, Senior Analyst, VLOOKUP, Analytical, SEO, SQL",3+ weeks ago
Lattice - Analyst,1lattice,0-3 Yrs,,"Gurugram, Bengaluru",Logical and focused approach in solving client problems . Analytical with ability to de...,"Interpersonal skills, Data analysis, Data management, Business research, Equity research, Pharma, Analytical, Pharmacy",3+ weeks ago
Senior Data Scientist- Machine Learning,Trinity Life Sciences,0-5 Yrs,,Bengaluru,Effective communication and presentation skills. . A graduate degree is requiredExperie...,"algorithms, python, data analysis, modeling, strong analytical skills, presentation skills, predictive, problem solving",3+ weeks ago
Decision Analyst,Barclays,0-8 Yrs,,Noida,". Hands-on experience in developing predictive statistical models, forecasting techniqu...","Loans, Data analysis, Senior Analyst, Analytical, Manager Quality Control, Continuous improvement, Forecasting, Operations",3+ weeks ago
Data Scientist I,Sparta Systems,0-5 Yrs,,Bengaluru,"Bachelor s degree or Advanced degree in Computer Science, Statistics, Mathematics, or r...","Computer science, Data analysis, Statistical modeling, data science, Analytical, Machine learning, Programming, Mathematics",3+ weeks ago
Walk-in || Finance Apprentice Analyst- Pune,eClerx,,,,Shift Timings - Fixed Night Shifts  Management Level: Apprentice_Analyst  Location: Pun...,"Finance, NISM, fresher, Investment Banking, KYC, Derivatives, Investment",1 day ago
Data Engineer,Billions United,0-2 Yrs,,Bengaluru,"To succeed in this data engineering position, you should have strong analytical skills ...","algorithms, python, data analysis, modeling, data mining, strong analytical skills, data pipeline, data engineering",3+ weeks ago
